<?xml version="1.0" encoding="UTF-8"?>
<tests xmlns:xsi="http://www.w3.org/2001/XMLSchema-instance"  
    xsi:noNamespaceSchemaLocation="xml/schemes/configuration.xsd">   

    <test>
        <commissions recording="true" dynamic="false" packageSending="false" choosingByCost="true" STDepth="8" worstCommissionByGlobalTime="false" algorithm="BruteForceAlgorithm" autoConfig="false" firstComplexSTResultOnly="false">benchmarks/dynamicA/pdp_100/lr101.txt</commissions>
        <!--<algorithmAgentsConfig>
        	<param name="ala" value="ola"/>
        	<param name="ula" value="as"/>
        </algorithmAgentsConfig>-->
        <defaultAgents>        
        	<truck power="600" reliability="4" comfort="4" fuelConsumption="20"/>
        	<trailer mass="200" capacity="200" cargoType="1" universality="4"/>
        </defaultAgents>
        <configuration>agenty_testy/25_200</configuration>
        <results>agenty_testy/lr101_classic/lr101</results>
	</test>
</tests>
